name,photo,url,category,country,reason,reason_url
McDonald's,,https://www.mcdonalds.com,Restaurant,US,McDonald’s operator has been offering discounts to Israeli soldiers,https://edition.cnn.com/2023/10/23/business/mcdonalds-israel-middle-east/index.html
Puma,,https://puma.com,Sport,DE,Puma sponsors the Israel Football Association,https://bdsmovement.net/boycott-puma
Carrefour,,https://www.carrefour.com,Retail,FR,Carrefour is entering a partnership with the Israeli company Electra Consumer Products and the supermarket chain it owns (Yenot Bitan),https://www.carrefour.com/en/news/carrefourpartenariatisrael
Starbucks,,https://starbucks.com,Retail,US,,https://edition.cnn.com/2023/10/13/business/starbucks-israel-palestine-workers/index.html
Disney,,https://disney.com,Entertainment,US,$2 million donation to israel,https://www.creativecommunityforpeace.com/blog/2023/10/12/israel-under-attack-open-letter
